id,bid,user_id,用户昵称,微博正文,头条文章url,发布位置,艾特用户,话题,转发数,评论数,点赞数,发布时间,发布工具,微博图片url,微博视频url,retweet_id
4558431346756535,Jow46slGn,7500304289,用户7500304289,从脱贫到致富，平安产险推进全面脱贫与乡村振兴有效衔接近日，广东省扶贫开发领导小组召开全省决战决胜脱贫攻坚视频会，再动员再安排收官阶段产业扶贫、消费扶贫等重点工作，确保如期全面高质量打赢脱贫攻坚战。作为金融扶贫的排头兵，保险应顺势而为，服务经济全局，在脱贫攻坚和乡村振兴衔接期，全力推动乡村产业发展。目前，平安产险在广东地区通过扶智贴息、产业扶贫、科技助农，探索出一条巩固提升脱贫成效、助力乡村振兴的新路子，奋力书写扶贫答卷，用心绘就丰收美景。扶智贴息，帮扶创业致富带头人扶贫先扶智、扶贫必扶智。在决战脱贫攻坚、决胜全面小康的关键时期，为发挥金融企业的责任与担当，平安产险积极响应广东省培育各地“领头雁”的政策号召，与广东省扶贫办联合启动“广东省贫困村致富带头人农业产业扶持计划”，将贫困村创业致富带头人培育工作作为实施精准扶贫、精准脱贫的重要举措，培养一批在贫困村创业发展、增收致富并带领贫困群众共同致富的骨干力量，为促进贫困村产业发展、贫困户脱贫致富提供强有力的人才支撑和带动效应。据《广东省贫困村创业致富带头人培育方案》初步统计，广东省2277个相对贫困村，每村培育3－5名创业致富带头人，符合条件并录入全国扶贫信息库的致富带头人达7240人，按每人带动3户以上贫困户、低收入人群、边缘群体计，此计划可帮助3万户以上帮扶群体实现增收脱贫。同时，在平安集团统筹安排下，平安产险通过“村官工程”项目，为广东省贫困村致富带头人发展农业产业提供额度1000万元的贴息专项资金，降低贫困地区农业产业发展资金成本，助力贫困村致富带头人发展农业产业。目前，平安产险已为肇庆28名致富带头人，提供低息贷款820万元。产业扶贫，构建长效扶贫机制要真正实现“造血式”扶贫，关键要靠产业发展。早在2017年9月，平安产险便推出国内首个全产业链保险深度介入的造血扶贫模式—平安“扶贫保”，通过在贫困高发地区围绕扶贫产业，实现扶贫资金“免息免担保”，打造覆盖人、财、物的一揽子风险保障方案，带动农村、贫困地区产业发展。截至目前，平安“扶贫保”已在14个省份的贫困地区，落地101个产业扶贫项目，提供产业扶贫贷款近8亿元，联结建档立卡贫困户7.5万人次。产业发展的一个重要抓手是因地制宜发展特色产业。春砂仁是著名“四大南药”之一，是阳春市特色产品。为了帮助老产业焕发出新活力，挑起脱贫“大梁”，2019年12月，平安产险在阳江市阳春岗脊村落地产业扶贫项目，为当地春砂仁种植企业300万元扶贫贷款提供18万元全额贴息支持，惠及建档立卡贫困户30户。为了进一步帮助扶贫产业、扶贫产品走进市场、赢得市场，今年6月，平安产险在旗下平安好车主、平安好生活及平安好帮手各APP同步上线“农货节”活动，优选了春砂仁等近百种扶贫农产品，通过高管代言、地摊义卖、总部带货直播以及N场机构自行带货直播的“3+N”形式举办“农货节”，号召广大客户和员工参与消费扶贫。同时，为帮助企业扩大品牌知名度，平安产险联合春砂仁企业一起开展公益游学活动。8月22日，平安产险联合腾讯大粤网、广州市志愿者协会组织了20个家庭前往金花坑春砂仁种植基地，在开学前给小朋友开展春砂仁知识游学，参观春砂仁博物馆、知识问答、亲手种下春砂仁树苗，通过自己的亲身经历记住这一有着1300年历史的农产品。聚“砂”成塔，截至目前，平安产险已为春砂仁产业扶贫项目“带货”近千盒，总金额逾20万元。金融科技，打造智慧农险新平台广东是农业大省和经济大省，农产品品种多，特色作物占比高，农业新型经营主体发展快，但由于地处沿海，自然灾害多发频发，区域发展不平衡。因此，通过发展农业保险转移“三农”风险，组织经济补偿，提升防灾减灾救灾能力，便显得尤为重要。为推动农业保险高质量发展，解决农业保险中承保与理赔难、农民获得感与幸福感不强以及农业保险信息不通畅等问题，在广东省委指导和广东省财政厅、广东省地方金融监督管理局、广东银保监局支持下，广东省农业农村厅联合平安产险成立专门攻关小组，在不到半年的时间里，研究开发了全国首个农业保险综合信息平台。该平台充分利用平安产险领先的科技创新能力，集政府服务、农业保险、灾害预警、防灾减灾于一身，链接农户投保、财政补贴申请、农险一张图数据分析等环节，通过将传统农业保险投保、公示等线下作业方式转移至线上，为农户简化投保手续、缩短承保流程和财政资金拨付流程，实现农业保险数据管理线上化、电子化、自动化、智能化、无纸化，助力广东农业保险高质量发展。目前，该系统已在阳江、清远、汕尾等地市试点，并开展系统相关培训工作。2020决胜脱贫攻坚，决胜全面小康的冲锋号已经吹响，广东脱贫攻坚蹄疾步稳。平安产险将积极承担社会责任，发挥“金融+科技”优势，与广东省人民一道，齐心协力，共奔小康。,,,,,0,0,0,2020-10-10 10:49,360安全浏览器,,,
4558047680927846,Jom5i3Tng,2477287611,贵阳客运段,“实锤”销售助力扶贫“31万多元！”手里攥着连续三个月的扶贫产品销售单，贵阳客运段旅服车间主任付杰迅速在心里将销售业绩“盘”了一遍，脸上露出了久违的笑容。今年，为落实国铁集团扶贫工作要点，贵阳客运段层层压实责任，传递扶贫攻坚压力，由段旅服车间具体负责，将来自宁夏、贵州等国家级重点扶贫区域的12个品种上万件扶贫产品分别做好仓储、保管、配送销售工作。上半年受疫情影响，部分旅客列车停运或上座率较以往同期偏低，一定程度上影响了扶贫产品的销售额。付杰心急如焚，他反复向车间干部职工强调道：“销售往往是产业链中最末端也最至关重要的一环，如何做好‘六稳六保’工作，扶贫产品的销售举足轻重！说白了，就是咱卖得越好就有可能保住更多人的饭碗！”下了决心，有了方向，接着就是群策群力想办法。付杰吃饭时会思考销售、走路时也在想怎么办。看到“直播带货”或是电梯里的销售广告，付杰都会认真一探究竟。经过多次上车实地考察、调研，向一线班组取经，付杰确立了后勤与前勤联动、线上线下同时销售的方案。后勤与前勤联动，旨在提升后勤为前勤主动精准服务的意识和技巧。后勤职工主动向厂家请教，梳理并归纳出各类产品的特点及卖点。同时，组织销售职工对食品进行试吃品鉴，在营销时确保准确无误地为旅客介绍口感和味道。再由班组提供各方向乘车旅客的购买习惯和喜好，收集旅客反馈意见。线上线下销售即一方面安排专人上车实地进行销售指导、提升销售技巧，另一方面通过职工体验式购买后形成口碑宣传，通过朋友圈扩大扶贫产品知名度，从而实现增收。“如今有不少旅客上车后都会主动询问列车上的扶贫产品，除了‘乌秀山泉’矿泉水的销售量名列前茅以外，‘绣莲外婆牛香吧’也是很多人指名要买的。”6至8月份的销售额较前5个月翻了番，付杰心里甜滋滋的。车间党支部书记刘荣龙也感叹地说，“脱贫攻坚只能玩实锤，还离不开集思广益！只要大家伙齐心，善于总结思考，抓住机遇，就能干得漂亮。”,,,,,0,0,1,2020-10-09 09:25,微博 weibo.com,"['http://ww2.sinaimg.cn/large/93a868bbgy1gjitn04e23j20hs0dc0u0.jpg', 'http://ww1.sinaimg.cn/large/93a868bbgy1gjitn5azu9j20dd0hrgme.jpg', 'http://ww4.sinaimg.cn/large/93a868bbgy1gjitnfs9p5j208i0bcwew.jpg', 'http://ww4.sinaimg.cn/large/93a868bbgy1gjitnmrozvj20hs0dcq3t.jpg']",,
4554868872712353,Jn1obbnBD,2236136725,忠县人民政府新闻办,告别贫困——脱贫攻坚看效果大型系列报道【乌杨街道庙塘村描绘出新气象】　　走进乌杨街道庙塘村，映入眼帘的是一幢幢农民新居、一条条宽敞干净的水泥路、一个个忙碌不停的身影……　　庙塘村位于乌杨街道东南部，与本街道李岗村、白坪村、楠木村、团结村接壤。全村海拔高度介于236米至330米之间，呈浅丘地貌。全村幅员面积2.7平方公里，耕地面积1957亩。该村下辖5个村民小组，共有559户1556人，其中贫困户40户136人。2016年，庙塘村实现整村脱贫。　　近年来，庙塘村村支“两委”和扶贫驻村工作队结合实际、找准路子、制定措施，不断增强内生发展动力，大力发展多个扶贫产业，引导村民勤劳致富，逐步实现了新村舍、新产业、新生活、新环境、新气象。　　齐心协力补短板，基础设施有效改善。近年来，庙塘村硬化村组公路5.2公里、人行便道16公里、产业便道6公里，有效改善了交通条件。现有山坪塘3口，自来水管网覆盖全村，村民生产生活用水得到保障。建有标准化村级卫生室1个，配备2名专业医生，村民看病不再难。新建村便民服务中心，配备图书室、活动室、体育场等设施，方便村民学习休闲。　　因地制宜兴产业，群众收入持续增加。庙塘村投资96万元，种植花椒300亩，并投资50万元建设花椒烤房、冻库和工作间。成立忠县庙塘花椒种植专业合作社，与40户贫困户建立利益联结机制，贫困户每年可分红300元。30名村民实现就近务工，每人每年增收3000元。庙塘村还大力发展土豆、冬瓜、南瓜等蔬菜种植产业，帮扶集团成员单位忠州中学师生食堂定点收购农产品，助力该村脱贫增收。村支“两委”和扶贫驻村工作队鼓励村民因地制宜种植中药材，共种植石菖蒲100亩。　　众志成城打硬仗，人居环境不断优化。近年来，庙塘村大力整治人居环境，完成易地扶贫搬迁1户，旧房整治提升及C、D级危房改造8户，改厕9户，村民居住条件得到较大改善。新建垃圾集中投放点10个，摆放垃圾桶36个，安排8名公益性岗位人员负责卫生保洁、道路养护等工作，保障村容村貌干净整洁。庙塘村充分利用院坝会、赶集日等契机，积极宣传环境卫生常识；开展“五户”评比活动，让更多村民参与到人居环境整治工作中；建立环境管护长效机制，引导村民养成良好的卫生习惯，用实际行动保护环境。　　如今的庙塘村，户洁村美、欣欣向荣，美好生活的蓝图渐渐成为庙塘村群众幸福生活的实景。文/周小军图/毛幼平O网页链接,,,,,1,0,3,2020-09-30 14:53,微博 weibo.com,"['http://ww3.sinaimg.cn/large/8548bd15ly1gj8okp7qdpj20lc0e7qcz.jpg', 'http://ww4.sinaimg.cn/large/8548bd15ly1gj8okp9redj20lc0dnn6t.jpg', 'http://ww3.sinaimg.cn/large/8548bd15ly1gj8okpdmpuj20lc0cb12v.jpg', 'http://ww4.sinaimg.cn/large/8548bd15ly1gj8okpdzakj20lc0ad112.jpg', 'http://ww3.sinaimg.cn/large/8548bd15ly1gj8okperv5j20gf0jbk00.jpg', 'http://ww2.sinaimg.cn/large/8548bd15ly1gj8okpbta0j20lb0cs13c.jpg', 'http://ww2.sinaimg.cn/large/8548bd15ly1gj8okpdhdkj20lc0duqbc.jpg', 'http://ww3.sinaimg.cn/large/8548bd15ly1gj8okpixatj20lc0c0dr3.jpg']",,
4554472884543536,JmR5uj3YQ,2236136725,忠县人民政府新闻办,【逛古街购山货尽享消费扶贫乐】“网友e家亲”采购山货扶贫志愿行动走进新生街道钟坝村　　9月27日，新生街道钟坝村，网友们逛古街、购山货、打糍粑，乐翻了天。当天，“网友e家亲”采购山货扶贫志愿行动走进新生街道，500多名网友踊跃参加，现场交易额实现15.6万元。　　本次活动由县政府办帮扶集团、县商务委、县农业农村委、县扶贫办、团县委、忠州日报社、新生街道办事处等单位主办，自媒体“本地头条”承办。　　“望水古街坐落在三面临空的山崖上，街道长约500米、宽仅2至3米……”随着导游的解说，网友们漫步在望水古街，欣赏着街道两旁的古朴建筑。　　网友钟华明是一名建材销售商。两天前，他听说这次网友活动将在钟坝村开展，便特意邀约了几个朋友一起报名参加。“望水古街的建筑十分独特，我很喜欢这里。”钟华明说，望水古街的四合院、青石板、木墙、木门，还有特殊年代的标语，都彰显着忠县的历史文化，勾起了许多人的乡愁。　　半小时后，网友们游完望水古街来到三湾大塘居民点。土鸡、土鸭、猕猴桃、蜂蜜、花生、南瓜……50多名村民摊前整整齐齐摆放着各种山货，网友黎万川径直走到贫困户刘平的摊位前，买走1只土鹅、2只土鸡。　　刘平是钟坝村一组贫困户，60多岁。他一共卖了2只土鹅、4只土鸡、40多公斤南瓜、10多公斤丝瓜和10公斤红苕粉，收入800多元。像刘平一样，当天钟坝村贫困户的山货都卖得不错。　　适逢国庆、中秋“双节”将至，网友活动还穿插了打糍粑、品豆花等趣味比赛。比赛中，参赛网友齐心协力，围观网友呼声不断，现场一片欢乐的海洋，活动掀起一阵阵高潮。　　“这样的爱心活动很有意义，既让自己愉悦了心情，又帮助了贫困户。”网友黎万川说，今后他会发动身边的亲戚朋友跟自己一起参加这样有意义的消费扶贫活动。　　近年来，钟坝村创新思路，引进重庆豪果生态农业开发有限公司建成猕猴桃种植园500余亩，通过“村集体+农户+企业”模式养殖土鸡3500只，并通过土地流转、季节性务工等形式增加贫困户收入，帮助贫困户脱贫增收。　　　　　　文图/记者邓青春O网页链接,,,,,1,1,2,2020-09-29 12:40,微博 weibo.com,"['http://ww3.sinaimg.cn/large/8548bd15ly1gj7f3gsu5rj20lc0e8tim.jpg', 'http://ww1.sinaimg.cn/large/8548bd15ly1gj7f3gt13ij20lc0di119.jpg', 'http://ww1.sinaimg.cn/large/8548bd15ly1gj7f3gwvqij20lc0dpgtx.jpg', 'http://ww3.sinaimg.cn/large/8548bd15ly1gj7f3h01cqj20lc0een5u.jpg', 'http://ww1.sinaimg.cn/large/8548bd15ly1gj7f3guf5sj20lc0dedo1.jpg', 'http://ww1.sinaimg.cn/large/8548bd15ly1gj7f3gwze3j20lc0e4tiq.jpg', 'http://ww3.sinaimg.cn/large/8548bd15ly1gj7f3gxs1dj20lc0eddot.jpg', 'http://ww1.sinaimg.cn/large/8548bd15ly1gj7f3gy1shj20lc0e8dp2.jpg', 'http://ww2.sinaimg.cn/large/8548bd15ly1gj7f3gzt89j20lc0dwqbx.jpg']",,
4549807769649430,JkTJ6EufY,3723195797,中卫市新闻传媒中心,【中卫：社会帮扶凝聚攻坚合力】（全媒记者杨雪实习生鲍冰）近年来，我市坚持政府主导、部门支持、全社会共同参与，统筹推进驻村帮扶、干部帮扶、定点帮扶，形成社会用力帮、干部齐心做的攻坚态势，不断深化社会帮扶，深入推进金融扶贫，凝聚脱贫攻坚合力。我市建立了机关干部联系帮扶贫困户工作制度，实现8341名干部帮扶贫困户全覆盖。2017年以来，全市各部门（单位）通过自筹、协调社会组织和企业累计投入各类帮扶资金约7.89亿元。并不断深化闽宁对口扶贫协作，中卫与漳州两市党政主要负责同志带队互访13次，推动市级层面卫生、教育等方面协作交流更深入更广泛，争取闽宁协作项目资金1.56亿元，涉及农业产业发展等50个项目。同时，中央定点帮扶企业华润（集团）有限公司为海原县投入帮扶资金4.79亿元，创新推进了“基础母牛+银行”、托管代养、集体经济分红三种扶贫模式，累计完成母牛赊销12926户次32051头，其中，向10469户建档立卡户赊销31409头，贫困户户均养牛3头以上，高标准建成并交付使用关桥华润希望小镇。我市深入推进金融扶贫，严格执行扶贫小额信贷政策，不断扩大金融扶贫覆盖面，从根本上破解贫困群众发展产业缺资金问题。目前，全市扶贫小额信贷存量贷款余额为3.08万户15.22亿元，户均贷款4.93万元，贷款覆盖率84.2%。今年1月至7月，全市累计发放扶贫小额信贷16845户79653.23万元，切实解决了贫困户发展产业缺资金难题。,,,,,0,0,0,2020-09-16 15:42,微博 weibo.com,,,
4549807752872909,JkTJ5c3nf,3149195684,中卫发布,【中卫：社会帮扶凝聚攻坚合力】（全媒记者杨雪实习生鲍冰）近年来，我市坚持政府主导、部门支持、全社会共同参与，统筹推进驻村帮扶、干部帮扶、定点帮扶，形成社会用力帮、干部齐心做的攻坚态势，不断深化社会帮扶，深入推进金融扶贫，凝聚脱贫攻坚合力。我市建立了机关干部联系帮扶贫困户工作制度，实现8341名干部帮扶贫困户全覆盖。2017年以来，全市各部门（单位）通过自筹、协调社会组织和企业累计投入各类帮扶资金约7.89亿元。并不断深化闽宁对口扶贫协作，中卫与漳州两市党政主要负责同志带队互访13次，推动市级层面卫生、教育等方面协作交流更深入更广泛，争取闽宁协作项目资金1.56亿元，涉及农业产业发展等50个项目。同时，中央定点帮扶企业华润（集团）有限公司为海原县投入帮扶资金4.79亿元，创新推进了“基础母牛+银行”、托管代养、集体经济分红三种扶贫模式，累计完成母牛赊销12926户次32051头，其中，向10469户建档立卡户赊销31409头，贫困户户均养牛3头以上，高标准建成并交付使用关桥华润希望小镇。我市深入推进金融扶贫，严格执行扶贫小额信贷政策，不断扩大金融扶贫覆盖面，从根本上破解贫困群众发展产业缺资金问题。目前，全市扶贫小额信贷存量贷款余额为3.08万户15.22亿元，户均贷款4.93万元，贷款覆盖率84.2%。今年1月至7月，全市累计发放扶贫小额信贷16845户79653.23万元，切实解决了贫困户发展产业缺资金难题。,,,,,0,0,0,2020-09-16 15:42,搜狗高速浏览器,,,
4549373730753132,JkIr339Vi,2175686497,济南日报,#济南爆料##济南身边事#【买货新去处！#济南#上线“永不落幕”的消费扶贫展销会】9月14日上午，山东省暨济南市消费扶贫产品展销周启动仪式在舜耕国际会展中心举行。本次展销周由山东省人民政府和济南市人民政府指导，山东省发展改革委、山东省扶贫开发办、山东省商务厅、济南市发展改革委、济南市扶贫办、济南市商务局联合主办，济南日报报业集团和山东省商会承办。#山东#展销周以“万企参与，亿人同行，消费扶贫，齐心鲁力”为主题，在现场共分湖南湘西、重庆武隆、西藏、新疆和山东五个特色扶贫展区。展销周自开市以来，来自新疆、西藏、重庆、湘西和全省各地市的扶贫产品玲琅满目、好货不断，不少济南的企业客户代表与商超代表慕名而来。此次扶贫产品展销周活动已成为了宣传、展示扶贫产品的最佳平台。“禾库牛肉”、“湘西猕猴桃”、“武隆干笋”“羊角豆腐干”……临近中秋国庆双节，展销会现场不少市民纷纷囤货，生怕错过这次扶贫产品展销机会。据记者了解，为了让市民更便捷购买扶贫产品，主办方同步上线“永不落幕”的消费扶贫展销会，在舜网(www.e23.cn)开通消费扶贫产品展销周专题，打通湘西、武隆两地农特产品生产、运输、包装、销售等全产业链条，市民通过线上即可购买到正宗的扶贫农特产品。此举旨在广泛动员社会力量通过线上消费参与扶贫，进而带动贫困户脱贫增收、上下游企业受益、消费者获得实惠、多方互利共赢的创新创业发展平台。记者在舜网首页首屏即看到“山东省暨济南市消费扶贫产品展销周”专题，点击进入目前线上展销分为武隆特产专场和湘西特产专场，武隆的豆干、稻米、红薯苕粉、高山茶，湘西的带皮牛肉、米豆腐、米粉等等近百种农特产品可以直接线上购买，且货源充足，市民可以放心购买，共同为东西部扶贫助力。（记者崔永久）,,,,"济南爆料,济南身边事,济南,山东",0,0,0,2020-09-15 10:58,微博 weibo.com,"['http://ww3.sinaimg.cn/large/81ae5761ly1gir2pkcq3vj20z90hi1kx.jpg', 'http://ww4.sinaimg.cn/large/81ae5761ly1gir2pk7b7gj20sk0h07kp.jpg', 'http://ww2.sinaimg.cn/large/81ae5761ly1gir2pk9jh6j20td0hcata.jpg']",,
4547166343272254,JjN0KdJgi,3526286391,国门天竺,齐心协力助扶贫，天竺镇主持召开顺义区对口帮扶沽源县工作联席会根据《北京市和河北省张家口市关于进一步加强京冀对口帮扶和全面合作框架协议》、《全面深化京冀扶贫协作三年行动框架协议》和《顺义区与沽源县携手奔小康行动协议书》精神，9月8日，天竺镇作为顺义区扶贫协作河北省沽源县牵头单位，主持召开了对口帮扶沽源县工作联席会议，研究2020年扶贫支援考核指标完成情况，部署下一步工作安排。天竺地区党委副书记、镇长周靖慧，顺义区发改委副调研员凌春华，地区党委副书记刘哲出席会议，马坡镇、北石槽镇、李桥镇、南彩镇、北小营镇、龙湾屯镇、杨镇、空港街道、国资中心、顺商集团、区供销社、顺建公司、大龙控股、综保区开发公司、文旅集团主管副职参加会议。会上，区发改委副调研员凌春华充分肯定了天竺镇牵头的组团单位对口帮扶沽源县工作，对今年扶贫攻坚形势进行了深入分析，鼓励大家要继续坚持问题导向，提高政治站位，齐心协力共同完成扶贫攻坚任务。党委副书记刘哲汇报了自顺义区对口帮扶沽源县以来帮扶工作总体开展情况，并强调：要扎实推进党政干部与专业技术人才赴沽源县支援脱贫攻坚工作；不断加大财政资金与社会捐赠的支持力度，因地制宜、精准谋划沽源县脱贫项目；持续引导有实力、有意愿的爱心企业赴沽源投资建厂，就近就地吸引当地贫困户就业增收；发挥首都资源聚集优势，帮助沽源县特色农副产品进京销售。会上，各单位相互交流了扶贫工作开展情况，并就下一步工作措施进行了充分讨论。天竺地区党委副书记、镇长周靖慧对各成员单位下一步扶贫支援工作作出安排，并强调：1要规范本单位、推荐结对的村（社区）党支部、企业和社会组织等签订的帮扶协议。从实际出发，着力解决关键问题，利用实地调研、视频连线、线上指导、慈善捐赠、消费扶贫等多种形式开展扶贫工作，将工作落到实处。2推荐结对的村（社区）党支部、企业和社会组织等要及时与沽源对接，灵活开展帮扶工作，把协作的领域进一步拓展、力度进一步加大、内容进一步丰富，实现资源共享、优势互补，联动共赢。3要加强产业带动扶贫工作力度，加大企业引导力度和企业援建扶贫车间力度，通过吸纳就业、利益联结等方式优先带动建档立卡贫困户增收。4要充分动员社会力量，实施精准扶贫。各成员单位要强化责任担当意识，积极筹措社会帮扶资金，同时激励贫困地区广大干部群众进一步行动起来，形成扶贫工作强大合力。,,,,,0,0,0,2020-09-09 08:46,微博 weibo.com,"['http://ww2.sinaimg.cn/large/d22edc37ly1gik3y4sqxsj20ic09zgx3.jpg', 'http://ww3.sinaimg.cn/large/d22edc37ly1gik3yartyzj20gb0mdatv.jpg']",,
