id,bid,user_id,用户昵称,微博正文,头条文章url,发布位置,艾特用户,话题,转发数,评论数,点赞数,发布时间,发布工具,微博图片url,微博视频url,retweet_id
4504103181326700,J1IK25z8o,5346472400,理财向导,午间点评：两市共涨停42只，跌停1只，热点集中在次新、疫情防护及新能源车概念中。新股次新：新产业金现代派瑞股份京北方芯瑞达北摩高科赛伍技术贵州三力皮阿诺万泰生物华辰装备；疫情防护：泰达股份沃特股份海鸥住工梦洁股份思创医惠国农科技司太立常山药业正川股份英科医疗莲花健康有友食品天味食品安记食品名臣健康；新能源车：泉峰汽车海汽集团长城科技和顺电气；中国芯：光力科技立霸股份；网红经济：御家汇天舟文化；特高压：保变电气永福股份；电商扶贫：供销大集；网络金融：旗天科技；工程机械：吉峰科技；无人机：炼石航空；5G：超华科技；消息板：恒林股份：拟收购厨博士家居100%股权。,,,,,0,0,0,2020-05-13 12:49,微博 weibo.com,,,
4504103160286498,J1IK01cwW,5878946571,涨势向导--张娜,午间点评：两市共涨停42只，跌停1只，热点集中在次新、疫情防护及新能源车概念中。新股次新：新产业金现代派瑞股份京北方芯瑞达北摩高科赛伍技术贵州三力皮阿诺万泰生物华辰装备；疫情防护：泰达股份沃特股份海鸥住工梦洁股份思创医惠国农科技司太立常山药业正川股份英科医疗莲花健康有友食品天味食品安记食品名臣健康；新能源车：泉峰汽车海汽集团长城科技和顺电气；中国芯：光力科技立霸股份；网红经济：御家汇天舟文化；特高压：保变电气永福股份；电商扶贫：供销大集；网络金融：旗天科技；工程机械：吉峰科技；无人机：炼石航空；5G：超华科技；消息板：恒林股份：拟收购厨博士家居100%股权。,,,,,0,0,0,2020-05-13 12:48,搜狗高速浏览器,,,
4504098001873015,J1IBG7RfV,5888649516,牛哥说市谈股论金,午间点评：两市共涨停42只，跌停1只，热点集中在次新、疫情防护及新能源车概念中。新股次新：新产业金现代派瑞股份京北方芯瑞达北摩高科赛伍技术贵州三力皮阿诺万泰生物华辰装备；疫情防护：泰达股份沃特股份海鸥住工梦洁股份思创医惠国农科技司太立常山药业正川股份英科医疗莲花健康有友食品天味食品安记食品名臣健康；新能源车：泉峰汽车海汽集团长城科技和顺电气；中国芯：光力科技立霸股份；网红经济：御家汇天舟文化；特高压：保变电气永福股份；电商扶贫：供销大集；网络金融：旗天科技；工程机械：吉峰科技；无人机：炼石航空；5G：超华科技；消息板：恒林股份：拟收购厨博士家居100%股权。#股市那些事##A股，风从哪里来##超短线牛股##短线牛股##个股专业点评##个股推荐##涨停板##今日股市##牛票推荐##牛股分享##牛股分析##今日市场##股市行情##股票推荐##每日牛股涨停板##今日牛股##今日短线股票推荐#,,,,"股市那些事,A股，风从哪里来,超短线牛股,短线牛股,个股专业点评,个股推荐,涨停板,今日股市,牛票推荐,牛股分享,牛股分析,今日市场,股市行情,股票推荐,每日牛股涨停板,今日牛股,今日短线股票推荐",0,0,3,2020-05-13 12:28,微博 weibo.com,['http://ww3.sinaimg.cn/large/006qwaK0gy1geqpmdolvbj30ic0riabb.jpg'],,
4342061132522834,HhEcxaAiS,5828261865,南京中方信富,#股市大事件，股民早知道##今日猛料#猛料丨2月21日（周四）股市猛料必看一、申购今日无新股申购与转债申购二、宏观经济1、央行：1月票据融资显著增加，支持了实体经济，特别是小微企业。个别企业通过票据贴现和结构性存款套利，只是短期的少数行为，不是票据融资增加的主要原因。总体看，1月份贷款处于合理水平，金融对实体经济的支持力度加大。2、国务院扶贫办：六年来，中国现行标准下的农村贫困人口从2012年底的9899万人减少到2018年底的1660万人，累计减少8239万人，贫困发生率从10.2%下降到1.7%，连续6年超额完成千万减贫任务。3、澎湃新闻：2月20日，科创板配套规则的公开征求意见期正式截止，这意味着，科创板的推进工作又迈入了新的阶段。各家券商已经着手进行了项目储备工作。下一步，针对科创板上市的行业指引、申请材料格式指引如招股书编报规则、战略配售细则等细化的指引文件将会陆续出台。4、中新经纬：截至目前，北京、上海等9省份2018年人均可支配收入超全国水平。上海2018年居民人均可支配收入达到64183元，位居全国第一位。在城乡居民人均可支配增速上，贵州以10.3％的增速位居第一，已经达到了两位数增长。5、新华社：金融机构与企业之间信息不对称是造成民营企业融资难、融资贵的重要原因。解决信息不对称问题，关键要打破“信息孤岛”，消除不同部门间的信息壁垒，建立统一的信息平台。打通信息壁垒给民企融资提速。6、央行：周三，开展200亿7天期逆回购操作，中标利率为2.55%，为七日以来首次进行逆回购操作。当日，开展2019年第一期央行票据互换（CBS）操作，本期操作量为15亿元，期限1年，费率为0.25%。三、股市新闻1、财经早餐：上证指数报2761.22点，上涨0.20%，成交额2054.47亿。深证成指报8473.43点，上涨0.39%，成交额2938.35亿。创业板指报1408.38点，上涨0.17%，成交额809.86亿。两市合计成交4992.82亿。今年2月以来，上涨股票占两市股票总数的比例高达98%（超3500只）。超90只股票连续上涨9天及以上。2、恒生指数涨1.01%，报28514.05点。国企指数涨1.01%，报11229.43点。北向资金沪股通资金流入32.29亿元，深股通资金流入19.50亿元，合计流入51.79亿元，连续十六日流入。1月以来，沪股通、深股通资金累计净流入金额达1037.70亿元。3、上证报：近期A股盘面和交易量均显示，部分主流保险机构不仅旗帜鲜明地看多A股，更是明显从前期的试探性买入转变为战略性加仓。至于未来的加仓幅度，部分主流保险机构内设的仓位目标是从目前10%不到的权益仓位，加至12%至15%左右。4、证券时报：ETF一般为被动指数型产品，但也有一部分进行主动管理的产品正在快速发展。截至2018年12月底，美国市场主动管理型ETF一共有257只，总规模为695亿美元，占ETF全市场规模的2.06%。虽然整体规模不大，但相比2017年底，产品数量增加了50只，规模增加了238亿美元。5、21世纪：近期，A股出现一轮上涨行情，杠杆资金逐步回升。由于对冲基金普遍认为A股估值偏低，加之美国经济放缓预期升温，今年以来众多对冲基金使用2-4倍资金杠杆加大A股配置。6、证券日报：开年以来，券商打新的热情升温。对今年以来已公布网下机构询价情况的13只新股进行统计后发现，本轮共有40家券商自营打新账户参与打新，平均获配1800股，浮盈449.91万元。但今年新股上市后的平均连板天数为5.44天，较2018年大幅度下降。7、证券时报：在股市普涨行情下，偏股基金逐步恢复赚钱效应。截至目前已经有52只偏股基金年内业绩超过了20%，成为基金反弹急先锋。其中收益率最高的是银华内需精选，达到23.91%。8、两市融资余额：截至2月19日，上交所融资余额报4551.93亿，较前一交易日增加32.86亿；深交所融资余额报2882.92亿，增加27.12亿元；两市合计7434.85亿元，增加59.98亿元。四、政策、行业指向热点★覆铜板迎来年内第二波涨价潮覆铜板概念股：金安国纪（002636）、生益科技（600183）、景旺电子（603228）、超声电子（000823）★工信部强调做好频谱资源使用保障，服务加快5G商用步伐大局5G概念股：欣天科技（300615）、超讯通信（603322）、宜通世纪（300310）、世纪鼎利（300050）★北斗船载终端产品迈出国门，北斗产业商用化开启加速北斗概念股：振芯科技（300101）、北斗星通（002151）、华测导航（300627）、合众思壮（002383）★T-1000级超高强度碳纤维核心技术实现突破碳纤维概念股：海源复材（002529）、方大炭素（600516）、沃特股份（002886）、博云新材（002297）★长三角顶层规划待出，“青吴嘉”一体化先行长三角一体化概念股：德邦股份（603056）、新朋股份（002328）、晋亿实业（601002）、亨通光电（600487）,,,,"股市大事件，股民早知道,今日猛料",0,0,0,2019-02-21 09:11,微博 weibo.com,,,
4280154249125364,GxDb2ChVi,6618132610,直男爱股票,【今日盘口】1、妖股线：市场高度德新交运，代表了老周期的龙头，同时也代表了这一阶段市场的选择方向，都是超跌为主，乐视网，中兴通讯，斯太尔等等，基本都是低价超跌属性。而这其中，走出连板市场高度的龙头，基本都是一开始的市场分歧，搞不清楚什么题材，一路分歧走上来，同时这些股基本都是流通盘极小的，本身又是超跌，很多筹码深度套牢进一步减少实际流通，这也符合现在市场，没有量，龙头的成交量太高无法支撑。作为十大精准扶贫工程之一，光伏扶贫得到前所未有的重视。自开展三年以来，光伏扶贫取得的效果有目共睹，成为助力脱贫攻坚的“绿色先锋”，真正实现了由“输血式”向“造血式”的转变。个股关注：林洋能源，一家经国家科技部认定的国家火炬计划重点高新技术企业，技术面上属于区间震荡后的跳空高开，留意背后的强势情况。2、科技线：5G板块重挫，中兴通讯一度跌逾8%，意华股份、邦讯技术、新易盛、沃特股份均跌7%，中通国脉、吉大通信纷纷跟跌。关于5g、泛科技领域，上周已经多次提及，因为中兴通讯短线连续强势后带来顶背离迹象，短期有回调需求，让大家提前获利离场，今日泛科技股果然如期回落。,,,,,0,0,0,2018-09-03 13:15,360安全浏览器,,,
4232994748708286,GdQlkAxqe,6065618246,股掌之上168,"002886沃特股份是市值最小的5G概念股,5G已经在开始应用,这个5G特种材料供应商前途无量！送配是10转5元派1元,还可以,最主要的是盘小市值低。#百万种车生活#@微博财经#扶贫攻坚#上证指数sh000001",,,微博财经,"百万种车生活,扶贫攻坚",0,0,0,2018-04-26 10:00,微博 weibo.com,,,
