id,bid,user_id,用户昵称,微博正文,头条文章url,发布位置,艾特用户,话题,转发数,评论数,点赞数,发布时间,发布工具,微博图片url,微博视频url,retweet_id
4511003746865664,J4CfYsO4w,3363252040,四川省扶贫开发局,【渠县扎实开展农产品销售帮扶】近年来，渠县坚持“围绕扶贫抓电商、抓好电商促脱贫”的思路，创新实施电商助力脱贫攻坚“五大工程”，初步形成线上线下互动、农户客户直通、增收脱贫并重的电商扶贫格局。一是建立健全县、乡、村电商服务体系。已完成县级电商服务中心建设，建筑面积2376平方米，包含特色产品展示中心、电商培训区、网商孵化区等功能板块。已建成乡镇电商服务站60个，村级电商服务站168个，其中贫困村服务站130个。二是建立健全县、乡、村物流配送体系。已完成县级电商物流集配中心建设，建筑面积2676平方米，现已入驻快递物流企业12家，包括顺丰速递、申通快递、韵达快递等。建成乡镇配送站60个、村级配送终端168个，三级物流配送体系基本建立。同时引入大型国企“中农联”入驻渠县，进一步培育县域电商物流市场。三是建设完善网销平台体系。推行“官方特色馆+创业者自营网店”模式，突出抓好渠县特色馆、创业网店建设，打造渠县特色产品“网上集市”。目前，已在苏宁易购、淘宝特色中国2大平台建立渠县特色馆，本土电商企业、创业网商在淘宝、阿里巴巴平台开设网店200余个。四是实施“电商+销售”扶贫工程。推行“电商+产业基地”“电商+农业龙头企业”“电商+村党支部+贫困户”等模式，建立农产品线下展示、线上交易、产销对接机制，解决农产品销售难问题。在三板乡大雾村、渠南乡大山村、屏西乡汤家村、新市乡五通村等贫困村针对柑橘产业、柠檬产业、黄花产业以及贫困村土鸡蛋、秋葵等产品成功开展精准产业扶贫。累计销售柑橘130万斤、柠檬90万斤、鸡蛋3500盒、黄花20万斤、秋葵2万斤，销售总额达6000万元，助农增收1000余万元。通过运用电子商务发展关联产业覆盖农业专合组织68个，提供就业岗位1.5万余个，带动2万余贫困群众人均增收520多元。近年来，渠县坚持“围绕扶贫抓电商、抓好电商促脱贫”的思路，创新实施电商助力脱贫攻坚“五大工程”，初步形成线上线下互动、农户客户直通、增收脱贫并重的电商扶贫格局。一是建立健全县、乡、村电商服务体系。已完成县级电商服务中心建设，建筑面积2376平方米，包含特色产品展示中心、电商培训区、网商孵化区等功能板块。已建成乡镇电商服务站60个，村级电商服务站168个，其中贫困村服务站130个。二是建立健全县、乡、村物流配送体系。已完成县级电商物流集配中心建设，建筑面积2676平方米，现已入驻快递物流企业12家，包括顺丰速递、申通快递、韵达快递等。建成乡镇配送站60个、村级配送终端168个，三级物流配送体系基本建立。同时引入大型国企“中农联”入驻渠县，进一步培育县域电商物流市场。三是建设完善网销平台体系。推行“官方特色馆+创业者自营网店”模式，突出抓好渠县特色馆、创业网店建设，打造渠县特色产品“网上集市”。目前，已在苏宁易购、淘宝特色中国2大平台建立渠县特色馆，本土电商企业、创业网商在淘宝、阿里巴巴平台开设网店200余个。四是实施“电商+销售”扶贫工程。推行“电商+产业基地”“电商+农业龙头企业”“电商+村党支部+贫困户”等模式，建立农产品线下展示、线上交易、产销对接机制，解决农产品销售难问题。在三板乡大雾村、渠南乡大山村、屏西乡汤家村、新市乡五通村等贫困村针对柑橘产业、柠檬产业、黄花产业以及贫困村土鸡蛋、秋葵等产品成功开展精准产业扶贫。累计销售柑橘130万斤、柠檬90万斤、鸡蛋3500盒、黄花20万斤、秋葵2万斤，销售总额达6000万元，助农增收1000余万元。通过运用电子商务发展关联产业覆盖农业专合组织68个，提供就业岗位1.5万余个，带动2万余贫困群众人均增收520多元。近年来，渠县坚持“围绕扶贫抓电商、抓好电商促脱贫”的思路，创新实施电商助力脱贫攻坚“五大工程”，初步形成线上线下互动、农户客户直通、增收脱贫并重的电商扶贫格局。一是建立健全县、乡、村电商服务体系。已完成县级电商服务中心建设，建筑面积2376平方米，包含特色产品展示中心、电商培训区、网商孵化区等功能板块。已建成乡镇电商服务站60个，村级电商服务站168个，其中贫困村服务站130个。二是建立健全县、乡、村物流配送体系。已完成县级电商物流集配中心建设，建筑面积2676平方米，现已入驻快递物流企业12家，包括顺丰速递、申通快递、韵达快递等。建成乡镇配送站60个、村级配送终端168个，三级物流配送体系基本建立。同时引入大型国企“中农联”入驻渠县，进一步培育县域电商物流市场。三是建设完善网销平台体系。推行“官方特色馆+创业者自营网店”模式，突出抓好渠县特色馆、创业网店建设，打造渠县特色产品“网上集市”。目前，已在苏宁易购、淘宝特色中国2大平台建立渠县特色馆，本土电商企业、创业网商在淘宝、阿里巴巴平台开设网店200余个。四是实施“电商+销售”扶贫工程。推行“电商+产业基地”“电商+农业龙头企业”“电商+村党支部+贫困户”等模式，建立农产品线下展示、线上交易、产销对接机制，解决农产品销售难问题。在三板乡大雾村、渠南乡大山村、屏西乡汤家村、新市乡五通村等贫困村针对柑橘产业、柠檬产业、黄花产业以及贫困村土鸡蛋、秋葵等产品成功开展精准产业扶贫。累计销售柑橘130万斤、柠檬90万斤、鸡蛋3500盒、黄花20万斤、秋葵2万斤，销售总额达6000万元，助农增收1000余万元。通过运用电子商务发展关联产业覆盖农业专合组织68个，提供就业岗位1.5万余个，带动2万余贫困群众人均增收520多元。来源：渠县扶贫开发局,,,,,0,0,0,2020-06-01 13:49,微博 weibo.com,,,
4483398029006895,IyZyWBN6v,5929914151,绿之语农产品,"3.17更新1017消费扶贫农场3月中下旬精选蔬果产品一件代发规格及价位 一、新鲜水果2、红香酥梨（中通百世）带箱10斤装39.83、红心火龙果（中通韵达圆通）5斤装44.84、丰水梨（顺丰）5斤装31.85、甜酥梨（邮政）带箱10斤装356、人参果大果（中通）5斤39.8带箱10斤装55.87、临潼石榴（邮政）5斤大果45带箱10斤装6912枚大果9斤装759-12枚特大果888、冰糖甜橙（邮政中通）5斤装26带箱10斤装389、水果甜玉米（邮政中通）带箱10斤装39.810、海南金钻凤梨（中通）带箱10斤装34.811、膜袋红富士（中通、百世）带箱10斤大果3512、海南贵妃芒、玉芒（申通快递）带箱10斤中果48.813、奶油苹果（邮政中通）5斤39.914、海南红心木瓜5斤装25.8带箱9斤装32.915、新鲜柠檬（邮政中通）2斤中果7.55斤大果12.916、泰国香水小菠萝（中通百世）带箱10斤32.817、早香椿（顺丰）2斤4518、徐香猕猴桃（邮政）5斤大果30带箱10斤大果4819.临潼沙地板栗红薯（邮政）5斤28带箱10斤3820、海南哈密瓜、西州蜜（邮政中通圆通）1-2个装5-6斤29.9带箱10斤49.921、绿宝甜瓜（中通圆通百世邮政）3斤中果355斤大果49.922、羊角蜜甜瓜（中通圆通百世邮政）3斤装355斤装49.923、红美人香蕉（韵达百世中通）5斤装35.824、泰国龙眼（顺丰）净重4.5斤44.825、黄金蜜瓜（韵达）5斤装29带箱10斤3926、郁金香甜瓜（百世韵达中通随机）5斤装32带箱10斤装4527、花牛苹果（韵达）5斤28带箱10斤3828、贵妃枣、牛奶枣（邮政百世）5斤装3529海南金煌芒（申通快递）5斤中果35带箱10斤53二、新鲜蔬菜1、沙瓤西红柿（邮政、顺丰）5斤装33带箱10斤装50（55发顺丰）2、白萝卜（邮政中通）5斤装19带箱10斤装29.83、沙地水果红萝卜（邮政）5斤装19带箱10斤装29.84、红皮土豆（邮政中通）5斤19带箱10斤装29.85、紫皮水萝卜5斤装256、普罗旺斯西红柿4斤装45礼盒+2 三、干货休闲产品1、枇杷膏（顺丰）500克*2瓶装40500克*4瓶装652、陕西黄龙薄皮核桃（韵达）3斤装455斤装603、枣夹核桃（申通）3斤装505斤装754、富平柿饼（中通）3斤装505斤装755、新疆和田大枣（中通）3斤装305斤装406、新疆若羌灰枣（中通）3斤275斤装357、冬枣干（韵达中通）5包（1斤）3510包（2斤）558、枸杞（中通申通百世）红枸杞250克袋装25500克罐装35黑枸杞250克袋装28500克罐装38黑红配共250克30 1、.生鲜一旦发货不支持退款，不接受拒签。,签收前当面检查外包装有无破损，无破损的拒收不售后2.烂果，坏果提供资料赔付，赔付金额=（售价÷果子重量）×坏果重量3.签收24小时内拍照：坏果和快递面单一起的照片，必须清晰的看见单号，坏果，否则售后难处理4、因口感不适口等问题不能售后问题；5、快递员直接放入物业或小区写字楼的“快递包裹柜”默认为自动签收，超过12小时没有去取件的，我们不承担任何责任咨询微信18161875483（电话不接）",,,,,0,0,1,2020-03-17 09:34,HUAWEI Mate 10,"['http://ww3.sinaimg.cn/large/006tjjyDly1gcwo97604qj30m80m8449.jpg', 'http://ww4.sinaimg.cn/large/006tjjyDly1gcwo97hk5nj30m80m8gte.jpg', 'http://ww3.sinaimg.cn/large/006tjjyDly1gcwo97rt8dj30l40l47ai.jpg', 'http://ww1.sinaimg.cn/large/006tjjyDly1gcwo98255uj30m80et7fi.jpg', 'http://ww2.sinaimg.cn/large/006tjjyDly1gcwo98dz06j30i60i6jwy.jpg', 'http://ww1.sinaimg.cn/large/006tjjyDly1gcwo98nd1sj30m80m8wlm.jpg', 'http://ww1.sinaimg.cn/large/006tjjyDly1gcwo98yv9xj30m80m8wn0.jpg', 'http://ww1.sinaimg.cn/large/006tjjyDly1gcwo999jzuj30m80m8q8e.jpg', 'http://ww1.sinaimg.cn/large/006tjjyDly1gcwo99jncij30m80m87gv.jpg']",,
4473598108198816,IuSCCyoSY,5929914151,绿之语农产品,"1017消费扶贫农场2月中下旬精选蔬果产品一件代发规格及价位2.18更新一、抗病菌及干货休闲产品1、枇杷膏（顺丰）500克*2瓶装40500克*4瓶装652、新疆薄皮核桃（韵达）5斤装553、枣夹核桃（申通）3斤装505斤装754、富平柿饼（中通）3斤装685斤装95二、新鲜水果1、高山苹果（邮政）带箱10斤装452、洛川红富士（百世邮政中通）75-80果12枚净重4.6-4.8斤35元   80-85果9-10枚净重5斤39元中果70-79规格大小22-24个带箱十斤48元75-80果带箱十斤20—22个净重8.5斤55元80-90果带箱十斤16—18个净重8.8斤65元3、红心火龙果（顺丰）5斤装524、丰水梨（顺丰）5斤装31.85、大酥梨（邮政）带箱10斤装356、人参果大果（中通）5斤39.8带箱10斤装62.87、脆皮金桔（邮政中通）5斤装32.8带箱10斤装49.88、甜橙（邮政中通）5斤装26带箱10斤装389、水果甜玉米（邮政中通）带箱10斤装3510、贵妃青枣（顺丰）5斤装33.811、膜袋红富士（中通、百世）带箱10斤大果3512、海南贵妃芒（申通快递）带箱10斤中果48.813、新鲜草莓（顺丰空运）5斤装78.814、海南红心木瓜带箱9斤装29.815、新鲜柠檬（顺丰）5斤大果19.916、泰国香水小菠萝（中通百世）带箱10斤32.817、早香椿（顺丰）2斤49.818、徐香猕猴桃（邮政）5斤35带箱10斤60三、新鲜蔬菜1、沙瓤西红柿（邮政、顺丰）5斤装36带箱10斤装50（55发顺丰）2、白萝卜（邮政中通）5斤装19.8带箱10斤装29.83、黄瓜（邮政中通）5斤装29.8带箱10斤装464、西葫芦（邮政中通）5斤装29.8带箱10斤装39.85、莴笋（邮政中通）5斤装19.8带箱10斤装31.86、莲花白（邮政中通）5斤装19.8带箱10斤装29.87、紫皮洋葱（邮政中通）5斤装29.8带箱10斤装39.88、沙地红萝卜（邮政）带箱10斤装29.89、红皮土豆（邮政中通）带箱10斤装29.810、大白菜（邮政中通）带箱10斤装33.811、娃娃菜（邮政中通）5斤装3612、紫甘蓝（顺丰）5斤装31.913、紫长茄子（邮政中通）5斤装3514、西兰花（顺丰）5斤装4215、红皮黄壤红薯（邮政中通）带箱10斤装29.816、小青菜（邮政）5斤装2617、大叶矮杆菠菜（邮政）5斤装28（泡沫箱+3）18、白菜花（邮政）5斤装30.8防控抗疫，同舟共济，责任担当，义不容辞。增强体质，提高免疫力。产地直发，减少接触，新鲜采摘，生态健康！(因为疫情需要每件产品进行消毒，还有各地各村封路等原因发货和到货有可能延缓，不要催单，不接急单，不支持拒收退货，因封路产生的售后不予处理，还望谅解。）不发国难财。需要韭菜、大葱、小葱、蒜苗、青红椒、四季豆、荷兰豆等蔬菜私聊，另外单发不拼装.生鲜一旦发货不支持退款，不接受拒签。,签收前当面检查外包装有无破损，无破损的拒收不售后2.烂果，坏果提供资料赔付，赔付金额=（售价÷果子重量）×坏果重量3.签收24小时内拍照：坏果和快递面单一起的照片，必须清晰的看见单号，坏果，否则售后难处理4、因口感不适口等问题不能售后问题；5、快递员直接放入物业或小区写字楼的“快递包裹柜”默认为自动签收，超过12小时没有去取件的，我们不承担任何责任咨询微信18161875483（电话不接）",,,,,0,0,0,2020-02-19 08:32,HUAWEI Mate 10,"['http://ww3.sinaimg.cn/large/006tjjyDly1gc1er17zphj30qo0qoju9.jpg', 'http://ww1.sinaimg.cn/large/006tjjyDly1gc1eqz5s9uj30m80m80x6.jpg', 'http://ww4.sinaimg.cn/large/006tjjyDly1gc1eqzd5tkj30qo0k041w.jpg', 'http://ww4.sinaimg.cn/large/006tjjyDly1gc1er093koj30u01hc477.jpg', 'http://ww4.sinaimg.cn/large/006tjjyDly1gc1eqzn8cxj30m80m8dm3.jpg', 'http://ww1.sinaimg.cn/large/006tjjyDly1gc1eqzxef6j31400u04fl.jpg', 'http://ww2.sinaimg.cn/large/006tjjyDly1gc1er0h22kj30gp0m8wf3.jpg', 'http://ww2.sinaimg.cn/large/006tjjyDly1gc1er0slzij30m80m87f2.jpg', 'http://ww4.sinaimg.cn/large/006tjjyDly1gc1er11au3j30rs0ijmzy.jpg']",,
4473595973297593,IuSzbdPQZ,5929914151,绿之语农产品,"1017消费扶贫农场2月中下旬精选蔬果产品一件代发规格及价位2.18更新一、抗病菌及干货休闲产品1、枇杷膏（顺丰）500克*2瓶装40500克*4瓶装652、新疆薄皮核桃（韵达）5斤装553、枣夹核桃（申通）3斤装505斤装754、富平柿饼（中通）3斤装685斤装95二、新鲜水果1、高山苹果（邮政）带箱10斤装452、洛川红富士（百世邮政中通）75-80果12枚净重4.6-4.8斤35元   80-85果9-10枚净重5斤39元中果70-79规格大小22-24个带箱十斤48元75-80果带箱十斤20—22个净重8.5斤55元80-90果带箱十斤16—18个净重8.8斤65元3、红心火龙果（顺丰）5斤装524、丰水梨（顺丰）5斤装31.85、大酥梨（邮政）带箱10斤装356、人参果大果（中通）5斤39.8带箱10斤装62.87、脆皮金桔（邮政中通）5斤装32.8带箱10斤装49.88、甜橙（邮政中通）5斤装26带箱10斤装389、水果甜玉米（邮政中通）带箱10斤装3510、贵妃青枣（顺丰）5斤装33.811、膜袋红富士（中通、百世）带箱10斤大果3512、海南贵妃芒（申通快递）带箱10斤中果48.813、新鲜草莓（顺丰空运）5斤装78.814、海南红心木瓜带箱9斤装29.815、新鲜柠檬（顺丰）5斤大果19.916、泰国香水小菠萝（中通百世）带箱10斤32.817、早香椿（顺丰）2斤49.818、徐香猕猴桃（邮政）5斤35带箱10斤60三、新鲜蔬菜1、沙瓤西红柿（邮政、顺丰）5斤装36带箱10斤装50（55发顺丰）2、白萝卜（邮政中通）5斤装19.8带箱10斤装29.83、黄瓜（邮政中通）5斤装29.8带箱10斤装464、西葫芦（邮政中通）5斤装29.8带箱10斤装39.85、莴笋（邮政中通）5斤装19.8带箱10斤装31.86、莲花白（邮政中通）5斤装19.8带箱10斤装29.87、紫皮洋葱（邮政中通）5斤装29.8带箱10斤装39.88、沙地红萝卜（邮政）带箱10斤装29.89、红皮土豆（邮政中通）带箱10斤装29.810、大白菜（邮政中通）带箱10斤装33.811、娃娃菜（邮政中通）5斤装3612、紫甘蓝（顺丰）5斤装31.913、紫长茄子（邮政中通）5斤装3514、西兰花（顺丰）5斤装4215、红皮黄壤红薯（邮政中通）带箱10斤装29.816、小青菜（邮政）5斤装2617、大叶矮杆菠菜（邮政）5斤装28（泡沫箱+3）18、白菜花（邮政）5斤装30.8防控抗疫，同舟共济，责任担当，义不容辞。增强体质，提高免疫力。产地直发，减少接触，新鲜采摘，生态健康！(因为疫情需要每件产品进行消毒，还有各地各村封路等原因发货和到货有可能延缓，不要催单，不接急单，不支持拒收退货，因封路产生的售后不予处理，还望谅解。）不发国难财。需要韭菜、大葱、小葱、蒜苗、青红椒、四季豆、荷兰豆等蔬菜私聊，另外单发不拼装.生鲜一旦发货不支持退款，不接受拒签。,签收前当面检查外包装有无破损，无破损的拒收不售后2.烂果，坏果提供资料赔付，赔付金额=（售价÷果子重量）×坏果重量3.签收24小时内拍照：坏果和快递面单一起的照片，必须清晰的看见单号，坏果，否则售后难处理4、因口感不适口等问题不能售后问题；5、快递员直接放入物业或小区写字楼的“快递包裹柜”默认为自动签收，超过12小时没有去取件的，我们不承担任何责任咨询微信18161875483（电话不接）",,,,,0,0,0,2020-02-19 08:24,HUAWEI Mate 10,"['http://ww3.sinaimg.cn/large/006tjjyDly1gc1ei3w19ej30m80m80x6.jpg', 'http://ww3.sinaimg.cn/large/006tjjyDly1gc1ei42znhj30gp0m874o.jpg', 'http://ww3.sinaimg.cn/large/006tjjyDly1gc1ei4ap4oj30qo0k041w.jpg', 'http://ww1.sinaimg.cn/large/006tjjyDly1gc1ei4kro1j30m80m8dm3.jpg', 'http://ww4.sinaimg.cn/large/006tjjyDly1gc1ei4vjuqj31400u04fl.jpg', 'http://ww2.sinaimg.cn/large/006tjjyDly1gc1ei533vtj30qo0qojur.jpg', 'http://ww1.sinaimg.cn/large/006tjjyDly1gc1ei5d5jij30m80m87f2.jpg', 'http://ww3.sinaimg.cn/large/006tjjyDly1gc1ei5kftnj30rs0ijmzy.jpg', 'http://ww2.sinaimg.cn/large/006tjjyDly1gc1ei5t285j30qo0qoju9.jpg']",,
4448263392345789,Ikfyb9Qfj,2685484697,快递生态圈赵小敏,直播快递股【中国银河：快递行业在2020年仍将保持较高增速】中国银河认为，电商景气度将保持稳定增长态势，快递行业仍将享受此红利，叠加直播带货、电商扶贫、跨境购物等新增因素推动，快递行业在2020年仍将保持较高增速。推荐市占率领先的韵达股份、全能型物流公司顺丰控股，跟踪关注估值相对较低的中国外运、圆通速递、申通快递。,,,,,1,0,0,2019-12-11 10:41,微博 weibo.com,['http://ww3.sinaimg.cn/large/a0113e99ly1g9sl3p8cvqj20ow0a0abr.jpg'],,
4440267233271574,IgTx9dJ5k,6460619501,武汉东画之源网络科技有限公司,✨花生日记乐淘学院✨❥————🤓————❥11月19日星期二◆京东加速增长：Q3七成新用户来自下沉市场，物流外单提振收入；◆申通快递：10月快递服务业务收入19.80亿元，同比增长19.44%；◆中国电信与京东物流共同开展5G智能园区建设；◆华为：未来五年将投入15亿美金，全球发展500万开发者；◆我国建成世界首例原位3D打印双层建筑，高7.2米；◆南京拟发布网约车管理办法，携带宠物者不能乘车； ◆学而思海外学术研究院落地剑桥，剑桥将成立研究合作团队；◆财政部提前下达专项扶贫资金1136亿，涉及28省区市；⭕唯一真实的对我们说出刻薄、侮辱、伤感情的话的人，都是我们自家的人。 ⭕睡前玩手机增加抑郁风险。近日，韩国诚信女子大学心理学系一项研究发现，越是经常推迟睡眠时间的人，患忧郁症、焦虑症、失眠的可能性就越大。,,,,,0,0,3,2019-11-19 09:07,乐淘学院Android,,,
4418530658777160,I7M49APl6,3215082647,快递杂志,#习近平总书记重要指示#【申通快递董事长陈德军：申通“向下”发展、助农增收义不容辞的责任】“这不仅是对我们行业发展提出了更高的要求，更是申通“向下”发展、助农增收义不容辞的责任。”陈德军介绍，安徽砀山梨、万荣苹果、徐闻菠萝、大荔胡萝卜、湖南永兴冰淇淋红薯等农特产品，正通过由申通快递打造的“申鲜生活”电商平台从田间地头来到了百姓们的舌头。申通为特色产品定制绿色物流通道，网络覆盖全国超过25个省，助农产品已达300余种，并依托总部电商平台，多渠道定制化服务助力网点末端农产品销售，通过定点扶贫，实现企村结对、企村共建的目的，让越来越多的农产品通过申通快递实现从“田间到舌尖”的新鲜直达。同时，“绿色发展”也已成为申通快递重要发展战略之一。陈德军认为，绿色引擎推动行业绿色发展。近年来，在申通快递在绿色快递建设方面不断加大投入，自建基地，加大对绿色快递包装的研发和应用。2016年申通快递率先在行业内启用可循环环保芯片袋，并在浙江省建立“绿色环保”研发实验基地，截至目前环保芯片袋覆盖率已达99%，流通使用超过2亿次，每年减少可降解垃圾超过1万吨。同时，不断提升信息技术水平，实现绿色快递再升级。目前，申通全网电子面单使用率达99.51%，可降解包装袋全面投入网络使用，流通使用超过1.2亿个，绿色快递已成为申通的长远发展战略。@申通快递官微,,,申通快递官微,,0,0,0,2019-09-20 09:34,360安全浏览器,['http://ww2.sinaimg.cn/large/bfa24497ly1g75qbsv19jj20p00ha4qp.jpg'],,
4331355342793533,Hd9H8bIIZ,3229962754,陕视新闻,"【政府联合爱心企业提供岗位贫困大学生自立自强寒假勤工俭学】临近春节，不少学校都已陆续放寒假，不过对于西咸新区空港新城的几位贫困大学生来说，今年他们将度过一个特别的寒假，因为在“助飞行动”暖梦计划的帮助下，他们开始了寒假带薪实习。本次活动是空港新城教育扶贫创新项目“助飞行动”的子计划“暖梦行动”的一部分。除申通快递西北转运中心以外，陕西天烁精密机械有限公司、陕西森泉建筑工程有限公司也将为贫困大学生提供6个寒假带薪实习岗位。贫困大学生在实习期间，由企业提供免费工作餐，每名学生每天薪水不低于100元。工作人员表示，后期他们将组织更多的学生、更多的企业,来参与到这种活动之中,来提高帮扶的覆盖面和覆盖率。（记者：张华）L陕视新闻的微博视频",,,,,2,0,4,2019-01-22 20:10,lucky小编iPhone客户端,,"http://f.us.sinaimg.cn/003io1ttlx07qYcN3rZS01041200nl8R0E010.mp4?label=mp4_ld&template=640x360.28.0&ori=0&ps=1BVp4ysnknHVZu&Expires=1602653999&ssig=5TbJ8%2FZw9l&KID=unistore,video",
