id,bid,user_id,用户昵称,微博正文,头条文章url,发布位置,艾特用户,话题,转发数,评论数,点赞数,发布时间,发布工具,微博图片url,微博视频url,retweet_id
4269950904290448,GtlK2i08M,6568759852,现代电商与物流研究院,"#今日头条#❶申通快递控股股东再度质押股权，累计质押达317,298,898股❷北京建设拟与普洛斯共同建立基金，并向基金出售67亿物业❸再下一城，京东配送机器人落户雄安❹全面布局!利群收购乐天更名""利群时代""新店亮相❺沃尔玛测试杂货配送机器人，计划年底覆盖2000家门店❻辽宁沈阳发现非洲猪瘟疫，已得到有效控制❼中国电商扶贫联盟启动，首批覆盖全国340个贫困县❽首批经业界标准认证的大闸蟹即将问世#物流##电商#",,,,"今日头条,物流,电商",0,4,3,2018-08-06 09:31,微博 weibo.com,,,
4260921444029423,GpyQogUeH,6293551142,IN辽阳,#辽阳身边事#【市交通局领导对辽阳邮政“交邮合作”工作进行调研】7月11日，市交通局领导赴辽阳市邮政管理局、辽阳申通快递营业网点、辽阳顺丰快递营业网点、辽阳圆通快递分拨中心、辽峰小镇（邮政农产品返程基地）开展调研。在调研现场，市交通局领导详细询问、了解邮政、快递业务的开办种类、业务收入、经营情况等问题，详细了解了辽阳邮政“交邮合作”具体情况。市交通局局长张君昶对邮政行业提出四点意见：一是积极支持快递行业健康发展；二是以“四好农村路”创建为载体，全面做好“交邮合作”；三是积极总结快递行业精准扶贫经验做法；四是加快推动辽峰小镇停车场建设。来源：辽阳交通,,,,辽阳身边事,0,0,3,2018-07-12 11:31,iPhone客户端,"['http://ww4.sinaimg.cn/large/006RV69oly1ft6x5rh6gqj30k30d8dqs.jpg', 'http://ww2.sinaimg.cn/large/006RV69oly1ft6x5rz6cvj30jz0dd165.jpg', 'http://ww1.sinaimg.cn/large/006RV69oly1ft6x5slerdj30je0dh4e6.jpg', 'http://ww1.sinaimg.cn/large/006RV69oly1ft6x5tw22xj30ka0dcal7.jpg', 'http://ww2.sinaimg.cn/large/006RV69oly1ft6x5usykzj30j30ditlu.jpg', 'http://ww4.sinaimg.cn/large/006RV69oly1ft6x5vdvpej30k60djtl9.jpg']",,
4248198950335700,GkdSf1pkw,3687395130,牛骑士,#微博股票##新浪财经#今日热点前瞻：CDR概念：6月6日深夜，CDR细则正式公布。6月6日下午，华夏、嘉实等6家基金公司上报的“战略配售”基金获得证监会发行批文。（相关个股：普路通、麦达数字、宇环数控、路畅科技、新华都、石基信息、三江购物）；仓储物流：6月，天猫、京东、苏宁等主要电商平台正式进入618大促季（相关个股：诺力股份、申通快递、顺丰控股、韵达股份、东方嘉盛、畅联股份）；征信服务：近日，百行征信有限公司宣布正式挂牌营业。（相关个股：银之杰、航天信息、新国都、高伟达、汇金股份）；高铁：7月1日起，中国铁路上海局集团有限公司将实施今年第二阶段列车运行图。（相关个股：华铁股份、高盟新材、飞鹿股份、中铁工业）；通信设备：工信部近日印发《关于推进网络扶贫的实施方案（2018-2020年）》，以推进网络基础设施建设为突破口。（相关个股：信维通信、欧菲科技、鹏博士、亨通光电、烽火通信、长江通信）；上证指数sh000001,,,,"微博股票,新浪财经",0,0,0,2018-06-07 08:57,今日看盘超话,,,
4223220439793109,G9K4jF5Dn,3880396242,最爱双子射手座,自从二月知道@东方卫视番茄台、@东方卫视我们在行动东方卫视我们在行动这个公益项目有钟汉良参加以来，就关注了乐农社@乐农社，并且在上面陆陆续续下了大概有近30个订单，花的钱大概也不会少于5000块。发现乐农社存在的问题很多，尤其最近购买沃柑，因为是新鲜水果，出现的问题更多，但是乐农社很少能积极主动的，或者是正面的解决问题，总是推诿塞责，消极对待。比如一箱水果坏了一半，乐农社先说补偿15元优惠券，这是处理问题的正确方式吗？后来一再交涉下，才说重新给人发货。有的水果表面看不出问题，但是每一个其实里面都坏了，果肉松塌塌，一股酒味，拍照看不出来，就说看不出问题，拒绝赔偿。今天跟他们联系，说我们大概要购买三四十箱沃柑，捐赠给敬老院、儿童福利院，希望他们能够从源头上把好质量关，让公益活动不至于成为笑话。客服却说，水果没办法掌控，运输过程可能出现的问题，天气原因等等，都无法保证水果质量。我说顺丰快递一直做鲜果运输，为何要用申通快递呢，出现了一堆运输问题，还解决不了！她说不是他们决定的等等各种消极推诿的回答。既然你选择了作为公益事业的平台，既然你选择了做水果这个产品，就要想办法把好质量关，而不能事不关己的态度。这样子能长久的做下去吗？选择你这个平台买那么多东西，是因为公益，因为扶贫助农，但是请不要亵渎了公益这个词，请不要让扶贫助农成为一个幌子，成为一个笑话！其实我之前购买的二十多箱沃柑，除了还没到货的五箱，其他的还好，坏果不算多。希望这份幸运能留到最后，留到这次即将到来的公益捐赠活动。至于乐农社，以后，可能江湖永不再见公益扶贫的平台很多，真的不止你们这一家！@东方卫视番茄台@东方卫视我们在行动也希望你们选择平台时，多多考察一下，不要让扶贫助农变成一个短期行为，变成商家牟利的工具。一家之言，不见得对，只是这两个月的个人感受罢了！,,,"东方卫视番茄台,东方卫视我们在行动,乐农社",,5,28,57,2018-03-30 10:41,梦中哇送的iPhone 7 Plus,['http://ww4.sinaimg.cn/large/e74a25d2gy1fpumxxve44j20qo1bf78m.jpg'],,
4200014529996963,G00nqFWFl,5981305551,圣元堂产业,四大措施促进农村电商发展！导读：农村电商这块大蛋糕，令许多人垂涎三尺。但是农村电商到底该怎么干？合作社、农业企业、种养殖大户等经营主体又该如何抓住这些机遇？究竟什么是农村电商？电商的概念是网上买卖，也不仅仅是工业品下乡或农产品进城。“乡愁圆梦”云南绿色农特产品电商平台，立足农村，聚集乡村资源，以销售本地特色产品为主，将农产品运用网上途径销售出去，将电商的物流、人才流、信息流、资金流聚集在县城周边，形成电商服务业、包装仓储物流相关产业和商品配套集群发展县域电商。农村电商怎么做？深入推进电子商务进农村综合示范项目推动农村电商公共服务体系建设支持县域电子商务公共服务中心和乡村级电子商务服务站点的建设和信息化改造。建立完善县、乡、村三级物流配送机制，着重解决县乡村“最初一公里”、“最后一公里”物流瓶颈问题，让产品“出得来”、“下得去”。镇沅公共物流中心建设情况公司在“乡愁圆梦”镇沅农村电子商务服务中心旁设立了镇沅公共物流仓储配送中心2300平方米，现已进驻有沅通物流、申通快递、德邦物流、圆通快递等物流经营实体，开通了镇沅到昆明、镇沅到普洱、镇沅到各乡（镇）的物流运输专线，在各9个乡（镇）建立了物流配送站，配置了7辆物流车，已经在为全县农村电子商务的物流运输服务，完成了农村物流体系的整合建设。提升农村特色产品电商化水平圣元堂绿色产品加工厂一号厂房建设情况圣元堂建设了占地15600平米的绿色产品加工厂，敞开大门为全县农特产品生产企业、合作社、种植大户服务，加强农产品生产加工、分等定级、包装、冷链物流（正在建设中）、仓储配送等基础设施建设，并提供质检、品控、溯源、品牌培育等服务，推动农产品的电商化。开展农商互联，促进电商企业与农产品生产加工企业、合作社开展合作，依托线上电商平台，整合线下农产品仓储、加工、配送资源，打造新型农产品供应链。深化电商精准扶贫天麻种植2万多平方米，涉及农户60余家加大综合示范工作对贫困地区的支持力度，在扩大支持范围时向贫困村组倾斜。开展“电商专家、产业发展专家下乡活动”，组织相关领域专家赴镇沅县古城镇南京村、京联村、者东镇东洒村、木厂村等贫困村组进行现场指导。针对农村电商发展环境弱但潜在产品丰富的特点，推动电商企业与贫困村组的深度合作，探索建立市场化对口帮扶机制。加强农村电商人才培养培训班动态今年2月，普洱市农村电子商务推进会的领导到镇沅农村电子商务服务中心参观指导，交流中全面总结近年来农村电子商务进展，推广各地好的经验和做法。同时，组织对示范县各乡村负责人进行培训，加强地区间的经验交流，截止今日，圣元堂农商学院已组织培训39期，培养农村电商人才3000多人次，培育壮大镇沅农村电商市场主体。百尺竿头，农村电商正在发展。太多的机会，等待你来共同发展！,,,,,0,0,0,2018-01-25 09:49,专业版微博,"['http://ww3.sinaimg.cn/large/006wMWObly1fnsm3u9r99j30hs04d0up.jpg', 'http://ww1.sinaimg.cn/large/006wMWObly1fnsm3wnqggj30hs06ddhu.jpg', 'http://ww4.sinaimg.cn/large/006wMWObly1fnsm3yfz7ij30hs07m77i.jpg', 'http://ww4.sinaimg.cn/large/006wMWObly1fnsm408ukwj30hs0a079o.jpg', 'http://ww1.sinaimg.cn/large/006wMWObly1fnsm41kk0rj30hs0a0wig.jpg', 'http://ww2.sinaimg.cn/large/006wMWObly1fnsm42mr3gj30hs0a0gqz.jpg', 'http://ww3.sinaimg.cn/large/006wMWObly1fnsm44h8ylj30hs0a0dkn.jpg', 'http://ww1.sinaimg.cn/large/006wMWObly1fnsm46nio8j30hs090ab2.jpg']",,
4187417684185673,FAG8ghySR,2480818191,山西大学商务学院物流协会,#物协分享#[滞销农产品有了新出路邮政业公益联盟启动“物流扶贫”]12月20日，国家邮政局发展研究中心和中国银行联合发起了“邮政业公益联盟”的启动仪式。参加联盟的有国家邮政局发展研究中心、申通快递股份有限公司、顺丰控股股份有限公司、江苏寄递纵横网络有限公司、中益善源（北京）科技有限公司等五家成员单位。仪式上，联盟各方共同签署了《关于推动邮政业公益项目的战略合作框架协议》及《邮政业公益联盟战略合作框架协议》，。据了解，“邮政业公益联盟”是邮政行业龙头企业为了深入贯彻落实国家扶贫开发总体规划，实现2020年全面建成小康社会目标，成立的精准扶贫公益组织，致力于建设邮政行业公益扶贫基金，加强贫困地区快递物流网络建设，促进以公益消费带动贫困地区农产品进城，从而精准帮扶贫困人群。在扶贫模式上，邮政业可以发挥自身优势，利用快递物流网络，帮助贫困地区实现农产品进城等目标，从而实现精准帮扶。例如，利用中国银行开发出的“公益中行”APP，陕西咸阳淳化县的农民每天都能接收到很多条订单信息，往年屡屡滞销的苹果，今年不到过年便销售一空，农民单户增收比往年多了7000多元。“邮政业公益联盟是对扶贫攻坚模式的新探索，其创新之处在于结合互联网、金融、邮政和公益五个行业的优势，充分整合优势资源参与扶贫攻坚任务，发挥不同行业在服务‘三农’中的协同作用，拓展向农渠道，推动行业转型升级和农业现代化建设。”国家邮政局发展研究中心主任曾军山表示。中国银行党务部部长潘超也表示，本次联盟意义重大，一是代表着邮政行业龙头企业全面参与精准扶贫，将分散的个人、企业行为转变成行业共同的行为；二是公益中行自此有了更强大的扶贫伙伴和战友，可以共同建设以“服务三农”、“发展农业”为目标的共享平台；三是本次合作有望解决贫困地区“农产品品质”和“物流成本高”两个核心问题。未来，邮政业公益联盟将依托中国银行精准扶贫共享平台“一起善源”全面展开工作。目前，该平台已拥有185余万爱心人士、264家公益联盟企业，帮扶了贫困县45个，累计受益贫困人口达90余万。,,太原·山西大学商务学院,,物协分享,0,1,1,2017-12-21 15:33,魅蓝 E2,['http://ww1.sinaimg.cn/large/93de480fly1fmofdudoqbj216b0qon1t.jpg'],,
4175371136451662,FvCKlr4n4,3035091371,英盛网,#总经理学院#总经理学院日报丨星期六（11月18日）1.腾讯与工商总局竞争执法局签订战略合作：探索创建“无传销网络平台”；2.证监会核发5家企业IPO批文，筹资总金额不超过30亿元；3.阿里巴巴8亿元南京拿地，江苏总部将正式落户南京；4.申通快递：10月快递服务业务收入11.44亿元，同比增长23.21%；5.2017年全球金融科技百强榜发布：蚂蚁金服排名第一；6.小米在俄罗斯开设全球首家24小时营业的小米旗舰店；7.外媒：丰田考虑在中国销售本土开发的电动汽车；8.全国扶贫小额信贷总量今年有望突破4000亿元；9.财政部：2018年普惠金融发展专项资金105亿元；10.国资委主任肖亚庆：国企改革不能停，也不会停下来。★把一件简单的事做好就不简单，把每一件平凡的事做好就不平凡——海尔公司总裁张瑞敏加入总经理学院，连接全球优质资源，为企业发展助力。免费体验链接：O网页链接,,,,总经理学院,0,0,0,2017-11-18 09:45,360安全浏览器,,,
4148052665332255,Fka4imna7,5939267156,久久天下网,临泉县电子商务物流全覆盖工作培训会在临泉电商园第一次成功召开，县商务局领导来指导工作，安徽久久天下电子商务有限公司和新盟物流有限公司主要负责人，申通快递，圆通快递中通快递，韵达快递，天天快递，各乡镇快递网店，各手机临泉电商精准扶贫网络线下店，参加会议，下一步对于农村电商物流全覆盖村级网店开发启动打开了新的篇章。,,,,,0,0,0,2017-09-04 00:31,OPPO R9s Plus,"['http://ww2.sinaimg.cn/large/006tWyHyly1fj6u1y6ajuj30zk0qojwx.jpg', 'http://ww3.sinaimg.cn/large/006tWyHyly1fj6u1zxb95j31be0qo7d4.jpg', 'http://ww4.sinaimg.cn/large/006tWyHyly1fj6u224bp2j31be0qo7cr.jpg', 'http://ww2.sinaimg.cn/large/006tWyHyly1fj6u24beslj31be0qojzo.jpg', 'http://ww3.sinaimg.cn/large/006tWyHyly1fj6u24yrx5j30m80cijsm.jpg', 'http://ww4.sinaimg.cn/large/006tWyHyly1fj6u2bk134j30zk0qon4q.jpg']",,
4122851525038996,F9Atil8S8,3980886844,M-慕斯卡,今年以来，我市启动了电商品牌培育工程和跨境电商企业培育等工程，成立了电子商务产业促进会，举办了电子商务讲师培训班，完善了电商扶贫工作方案，继续推进千家电商帮村工程，筹备召开了农商资源对接会，推动申通快递智能自动分拣机器人等重大项目正式运营，电子商务发展呈现出良好的势头。,,,,,0,0,0,2017-06-26 11:31,360安全浏览器,,,
4101879593922534,F0MTBgsqG,3481204752,临沂商务,【一季度我市电子商务实现快速发展】今年以来，我市启动了电商品牌培育工程和跨境电商企业培育等工程，成立了电子商务产业促进会，举办了电子商务讲师培训班，完善了电商扶贫工作方案，继续推进千家电商帮村工程，筹备召开了农商资源对接待会，推动申通快递智能自动分拣机器人等重大项目正式运营，电子商务发展呈现出良好的势头。O网页链接,,,,,0,0,0,2017-04-29 14:36,微博 weibo.com,,,
4055049292403339,En65ba5dx,1730709104,A5创业网,她22岁丧夫却在40岁时逆袭成为百亿富婆连马云都离不开她！　虽然事业上十分成功，可她并未忘记生养自己的山村，不仅出资修建了马路和各种生活设施，还设立了助学和扶贫基金等慈善项目，这个开挂的女人就是申通快递的创始人O网页链接,,,,,1,0,0,2016-12-21 09:09,360安全浏览器,,,
4037132500245461,EfzZ811R3,5092878633,懒懒的细猫,果农需要大家的帮忙，谢谢了，麻烦看到的转发下，可以微信留言，也可以打对方的手机号码，拜托了，45元10斤包邮全国，当地的申通快递，扶贫运费都是减半了,,,,,0,0,0,2016-11-01 22:34,荣耀X2,"['http://ww4.sinaimg.cn/large/005yFcnLjw1f9czbcf3kmj30qo16o7dn.jpg', 'http://ww2.sinaimg.cn/large/005yFcnLjw1f9czbgm2lmj30qo16odpc.jpg', 'http://ww1.sinaimg.cn/large/005yFcnLjw1f9czc37f7cj30qo0zkmyw.jpg', 'http://ww2.sinaimg.cn/large/005yFcnLjw1f9czc3tdntj30qo0zk0vv.jpg', 'http://ww4.sinaimg.cn/large/005yFcnLjw1f9czc4md2dj30qo111doe.jpg', 'http://ww3.sinaimg.cn/large/005yFcnLjw1f9czc5eycpj30k00zk0x2.jpg', 'http://ww3.sinaimg.cn/large/005yFcnLjw1f9czcelt7xj30qo0zkdnt.jpg', 'http://ww4.sinaimg.cn/large/005yFcnLjw1f9czcf9b4wj30qo0zk79o.jpg', 'http://ww2.sinaimg.cn/large/005yFcnLjw1f9czcgr13lj30zk0qo79h.jpg']",,
3946078124656677,DjkHyjxpH,2009704051,你看到的我是蓝色的-Veronica,申通快递真是太恶心了！早点倒闭吧！多出来的钱给你扶贫了！,,,,,0,1,0,2016-02-24 16:16,华为P8,,,
3808738077240192,C3FjFunvi,1767640620,KN的K是KO的K,求扩散，大家再也不要用申通快递了，寄了一箱年货，吃的食品，6.5kg回家，结果说给我弄丢了，也不主动解释赔偿，感觉职业道德被狗吃了。钱如果追不回来就当扶贫了，但是大家千万不要再用申通快递了，血和泪的教训。@申通快递官微,,,申通快递官微,,2,6,4,2015-02-10 16:36,荣耀3X畅玩版,,,
3767769113778115,BsqZ1fQRl,1498719921,公益中国网,机构携手电商在雅安推出产业扶贫新模式_公益要闻_新闻_公益中国网@中国扶贫基金会联合@国际美慈组织及雅安市群团组织社会服务中心发起，得到了@阿里巴巴集团企业社会责任部、@聚划算、新浪@微公益等平台的支持，菜鸟网络协调申通快递为本次活动提供物流支持。O网页链接,,,"中国扶贫基金会,国际美慈组织,阿里巴巴,聚划算,微公益",,0,1,1,2014-10-20 15:20,百度分享,['http://ww4.sinaimg.cn/large/5954a6b1jw1elhnf0ll08j20ci088ju1.jpg'],,
3701001989112931,B0q46CeGL,1858706940,Avril-Zheng,申通快递是流氓快递，拿了我在6688买的东西不送货，打电话催了好多天，还直接给我关机了，奇葩！6688的客服电话也是永远无人接听的，我不知道真的扶贫是这样的吗？客户下了单付了钱是不是就不管客户有没有收到货了吗？@维吉达尼@老榕@申通快递,,,"维吉达尼,老榕,申通快递",,1,5,0,2014-04-19 09:31,微博 weibo.com,,,
3578649620367707,zx02e1xEL,1937773140,丹丹dany-,#美丽雅安#灾区小朋友的大作如何送出？雅安申通帮你想办法！雅安申通提供免费物流支持！超级给力，满满的爱心将要出发喽~~@北京申通快递@爱心包裹项目@中国扶贫基金会@善行100,,,"北京申通快递,爱心包裹项目,中国扶贫基金会,善行100",美丽雅安,2,2,2,2013-05-16 18:27,iPhone客户端,['http://ww1.sinaimg.cn/large/73801254jw1e4qbccpb3lj204x0dm74w.jpg'],,
3542750169350185,zhW7SDepr,2427121770,mango801218,拿什么拯救你，申通快递！！你是这么多牛气么，申通快递，发往杭州滨江的货，你们能够发到温州苍南，你是去扶贫么？收件人的电话号码你们从没打过，你是在发件么？6次投诉结果分别是：找发件人自己联系去；弄错了尽快发回；我们尽快给你解决；我们上午12点回复；我尽快回复你；你错了，找发件人去！,,,,,1,0,0,2013-02-06 16:55,微博 weibo.com,['http://ww2.sinaimg.cn/large/90aaf06agw1e1jscd3el3j.jpg'],,
